"PassengerId","Name","Sex","Age","SibSp","Parch","Salary","Job"
773,"Mack, Mrs. (Mary)","female",57.0,0,0,1616.23,"carpenter-joiner"
774,"Elias, Mr. Dibo","male",,0,0,217.27,"blacksmith"
775,"Hocking, Mrs. Elizabeth (Eliza Needs)","female",54.0,1,3,1962.0,"coachmaker"
776,"Myhrman, Mr. Pehr Fabian Oliver Malkolm","male",18.0,0,0,145.82,"shoemaker"
777,"Tobin, Mr. Roger","male",,0,0,267.79,"wheelwright"
778,"Emanuel, Miss. Virginia Ethel","female",5.0,0,0,113.73,"wheelwright"
779,"Kilgannon, Mr. Thomas J","male",,0,0,364.6,"shoemaker"
780,"Robert, Mrs. Edward Scott (Elisabeth Walton McMillan)","female",43.0,0,1,2685.34,"music teacher"
781,"Ayoub, Miss. Banoura","female",13.0,0,0,384.67,"barber"
782,"Dick, Mrs. Albert Adrian (Vera Gillespie)","female",17.0,1,0,2643.53,"farrier"
783,"Long, Mr. Milton Clyde","male",29.0,0,0,4955.49,"music teacher"
784,"Johnston, Mr. Andrew G","male",,1,2,283.7,"wigmaker"
785,"Ali, Mr. William","male",25.0,0,0,193.57,"barber"
786,"Harmer, Mr. Abraham (David Lishin)","male",25.0,0,0,370.5,"wheelwright"
787,"Sjoblom, Miss. Anna Sofia","female",18.0,0,0,220.58,"wigmaker"
788,"Rice, Master. George Hugh","male",8.0,4,1,11.33,"wigmaker"
789,"Dean, Master. Bertram Vere","male",1.0,1,2,188.33,"weaver"
790,"Guggenheim, Mr. Benjamin","male",46.0,0,0,4546.88,"doctor"
791,"Keane, Mr. Andrew Andy","male",,0,0,362.01,"shoemaker"
792,"Gaskell, Mr. Alfred","male",16.0,0,0,646.71,"cabinetmaker"
793,"Sage, Miss. Stella Anna","female",,8,2,326.9,"blacksmith"
794,"Hoyt, Mr. William Fisher","male",,0,0,4137.4,"surgeon"
795,"Dantcheff, Mr. Ristiu","male",25.0,0,0,128.7,"weaver"
796,"Otter, Mr. Richard","male",39.0,0,0,719.34,"coachmaker"
797,"Leader, Dr. Alice (Farnham)","female",49.0,0,0,2491.55,"dentist"
798,"Osman, Mrs. Mara","female",31.0,0,0,360.7,"shoemaker"
799,"Ibrahim Shawah, Mr. Yousseff","male",30.0,0,0,336.7,"shoemaker"
801,"Ponesell, Mr. Martin","male",34.0,0,0,712.15,"carpenter-joiner"
802,"Collyer, Mrs. Harvey (Charlotte Annie Tate)","female",31.0,1,1,502.84,"shopkeeper"
803,"Carter, Master. William Thornton II","male",11.0,1,2,3806.19,"hatter"
804,"Thomas, Master. Assad Alexander","male",0.42,0,1,218.31,"blacksmith"
805,"Hedman, Mr. Oskar Arvid","male",27.0,0,0,330.31,"shoemaker"
806,"Johansson, Mr. Karl Johan","male",31.0,0,0,129.11,"shoemaker"
807,"Andrews, Mr. Thomas Jr","male",39.0,0,0,3840.78,"music teacher"
808,"Pettersson, Miss. Ellen Natalia","female",18.0,0,0,298.54,"wheelwright"
809,"Meyer, Mr. August","male",39.0,0,0,1209.48,"cabinetmaker"
810,"Chambers, Mrs. Norman Campbell (Bertha Griggs)","female",33.0,1,0,2398.69,"pharmacist"
811,"Alexander, Mr. William","male",26.0,0,0,256.64,"barber"
812,"Lester, Mr. James","male",39.0,0,0,176.82,"barber"
813,"Slemen, Mr. Richard James","male",35.0,0,0,466.8,"breechesmaker"
814,"Andersson, Miss. Ebba Iris Alfrida","female",6.0,4,2,140.45,"barber"
815,"Tomlin, Mr. Ernest Portage","male",30.5,0,0,70.19,"blacksmith"
816,"Fry, Mr. Richard","male",,0,0,3407.78,"music teacher"
817,"Heininen, Miss. Wendla Maria","female",23.0,0,0,324.52,"barber"
818,"Mallet, Mr. Albert","male",31.0,1,1,607.4,"bookbinder"
819,"Holm, Mr. John Fredrik Alexander","male",43.0,0,0,151.99,"blacksmith"
820,"Skoog, Master. Karl Thorsten","male",10.0,3,2,192.32,"weaver"
821,"Hays, Mrs. Charles Melville (Clara Jennings Gregg)","female",52.0,1,1,4166.79,"farrier"
822,"Lulic, Mr. Nikola","male",27.0,0,0,397.48,"wigmaker"
823,"Reuchlin, Jonkheer. John George","male",38.0,0,0,3953.57,"apothecary"
824,"Moor, Mrs. (Beila)","female",27.0,0,1,9.15,"blacksmith"
825,"Panula, Master. Urho Abraham","male",2.0,4,1,369.05,"wheelwright"
826,"Flynn, Mr. John","male",,0,0,94.45,"wheelwright"
827,"Lam, Mr. Len","male",,0,0,256.88,"barber"
828,"Mallet, Master. Andre","male",1.0,0,2,868.97,"cabinetmaker"
829,"McCormack, Mr. Thomas Joseph","male",,0,0,49.97,"wigmaker"
830,"Stone, Mrs. George Nelson (Martha Evelyn)","female",62.0,0,0,3157.42,"dentist"
831,"Yasbeck, Mrs. Antoni (Selini Alexander)","female",15.0,1,0,178.02,"wigmaker"
832,"Richards, Master. George Sibley","male",0.83,1,1,717.96,"cabinetmaker"
833,"Saad, Mr. Amin","male",,0,0,65.13,"shoemaker"
834,"Augustsson, Mr. Albert","male",23.0,0,0,46.54,"shoemaker"
835,"Allum, Mr. Owen George","male",18.0,0,0,228.62,"blacksmith"
836,"Compton, Miss. Sara Rebecca","female",39.0,1,1,4189.54,"doctor"
837,"Pasic, Mr. Jakob","male",21.0,0,0,30.99,"wheelwright"
838,"Sirota, Mr. Maurice","male",,0,0,14.0,"barber"
839,"Chip, Mr. Chang","male",32.0,0,0,83.38,"weaver"
840,"Marechal, Mr. Pierre","male",,0,0,2312.05,"hatter"
841,"Alhomaki, Mr. Ilmari Rudolf","male",20.0,0,0,34.19,"wheelwright"
842,"Mudd, Mr. Thomas Charles","male",16.0,0,0,674.34,"carpenter-joiner"
843,"Serepeca, Miss. Augusta","female",30.0,0,0,2653.78,"goldsmith"
844,"Lemberopolous, Mr. Peter L","male",34.5,0,0,227.84,"blacksmith"
845,"Culumovic, Mr. Jeso","male",17.0,0,0,16.34,"blacksmith"
846,"Abbing, Mr. Anthony","male",42.0,0,0,47.97,"wigmaker"
847,"Sage, Mr. Douglas Bullen","male",,8,2,180.26,"barber"
848,"Markoff, Mr. Marin","male",35.0,0,0,73.72,"weaver"
849,"Harper, Rev. John","male",28.0,0,1,1635.9,"breechesmaker"
850,"Goldenberg, Mrs. Samuel L (Edwiga Grabowska)","female",,1,0,4268.14,"hatter"
851,"Andersson, Master. Sigvard Harald Elias","male",4.0,4,2,339.49,"blacksmith"
852,"Svensson, Mr. Johan","male",74.0,0,0,331.05,"wheelwright"
853,"Boulos, Miss. Nourelain","female",9.0,1,1,275.69,"barber"
854,"Lines, Miss. Mary Conover","female",16.0,0,1,4351.27,"farrier"
855,"Carter, Mrs. Ernest Courtenay (Lilian Hughes)","female",44.0,1,0,613.24,"hatter"
856,"Aks, Mrs. Sam (Leah Rosen)","female",18.0,0,1,83.25,"wheelwright"
857,"Wick, Mrs. George Dennick (Mary Hitchcock)","female",45.0,1,1,4349.79,"music teacher"
858,"Daly, Mr. Peter Denis ","male",51.0,0,0,4825.21,"music teacher"
859,"Baclini, Mrs. Solomon (Latifa Qurban)","female",24.0,0,3,43.95,"barber"
860,"Razi, Mr. Raihed","male",,0,0,248.78,"barber"
861,"Hansen, Mr. Claus Peter","male",41.0,2,0,108.46,"wheelwright"
862,"Giles, Mr. Frederick Edward","male",21.0,1,0,871.96,"cabinetmaker"
863,"Swift, Mrs. Frederick Joel (Margaret Welles Barron)","female",48.0,0,0,4444.25,"goldsmith"
864,"Sage, Miss. Dorothy Edith Dolly","female",,8,2,332.37,"barber"
865,"Gill, Mr. John William","male",24.0,0,0,594.44,"shopkeeper"
866,"Bystrom, Mrs. (Karolina)","female",42.0,0,0,1227.51,"carpenter-joiner"
867,"Duran y More, Miss. Asuncion","female",27.0,1,0,1259.14,"carpenter-joiner"
868,"Roebling, Mr. Washington Augustus II","male",31.0,0,0,4447.86,"apothecary"
869,"van Melkebeke, Mr. Philemon","male",,0,0,18.71,"wigmaker"
870,"Johnson, Master. Harold Theodor","male",4.0,1,1,205.19,"weaver"
871,"Balkic, Mr. Cerin","male",26.0,0,0,283.29,"wheelwright"
872,"Beckwith, Mrs. Richard Leonard (Sallie Monypeny)","female",47.0,1,1,3147.0,"farrier"
873,"Carlsson, Mr. Frans Olof","male",33.0,0,0,3831.18,"goldsmith"
874,"Vander Cruyssen, Mr. Victor","male",47.0,0,0,316.63,"wigmaker"
876,"Najib, Miss. Adele Kiamie Jane","female",15.0,0,0,8.87,"wigmaker"
877,"Gustafsson, Mr. Alfred Ossian","male",20.0,0,0,393.28,"blacksmith"
878,"Petroff, Mr. Nedelio","male",19.0,0,0,190.59,"wigmaker"
879,"Laleff, Mr. Kristo","male",,0,0,248.57,"wigmaker"
880,"Potter, Mrs. Thomas Jr (Lily Alexenia Wilson)","female",56.0,0,1,2422.99,"pharmacist"
881,"Shelley, Mrs. William (Imanita Parrish Hall)","female",25.0,0,1,840.66,"shopkeeper"
882,"Markun, Mr. Johann","male",33.0,0,0,219.78,"shoemaker"
883,"Dahlberg, Miss. Gerda Ulrika","female",22.0,0,0,243.1,"wheelwright"
884,"Banfield, Mr. Frederick James","male",28.0,0,0,564.7,"hatter"
885,"Sutehall, Mr. Henry Jr","male",25.0,0,0,110.29,"blacksmith"
886,"Rice, Mrs. William (Margaret Norton)","female",39.0,0,5,58.51,"blacksmith"
887,"Montvila, Rev. Juozas","male",27.0,0,0,452.78,"silversmith"
889,"Johnston, Miss. Catherine Helen Carrie","female",,1,2,300.66,"blacksmith"
890,"Behr, Mr. Karl Howell","male",26.0,0,0,2628.22,"apothecary"
891,"Dooley, Mr. Patrick","male",32.0,0,0,200.0,"wheelwright"
892,"Kelly, Mr. James","male",34.5,0,0,186.57,"barber"
893,"Wilkes, Mrs. James (Ellen Needs)","female",47.0,1,0,366.84,"barber"
894,"Myles, Mr. Thomas Francis","male",62.0,0,0,1498.06,"shopkeeper"
895,"Wirz, Mr. Albert","male",27.0,0,0,298.59,"weaver"
896,"Hirvonen, Mrs. Alexander (Helga E Lindqvist)","female",22.0,1,1,349.43,"weaver"
897,"Svensson, Mr. Johan Cervin","male",14.0,0,0,341.41,"blacksmith"
898,"Connolly, Miss. Kate","female",30.0,0,0,341.44,"blacksmith"
899,"Caldwell, Mr. Albert Francis","male",26.0,1,1,878.04,"cutler"
900,"Abrahim, Mrs. Joseph (Sophie Halaut Easu)","female",18.0,0,0,200.48,"blacksmith"
901,"Davies, Mr. John Samuel","male",21.0,2,0,41.13,"blacksmith"
902,"Ilieff, Mr. Ylio","male",,0,0,179.78,"blacksmith"
903,"Jones, Mr. Charles Cresson","male",46.0,0,0,4047.87,"surgeon"
904,"Snyder, Mrs. John Pillsbury (Nelle Stevenson)","female",23.0,1,0,2986.73,"music teacher"
905,"Howard, Mr. Benjamin","male",63.0,1,0,636.13,"coachmaker"
906,"Chaffee, Mrs. Herbert Fuller (Carrie Constance Toogood)","female",47.0,1,0,3781.84,"goldsmith"
907,"del Carlo, Mrs. Sebastiano (Argenia Genovesi)","female",24.0,1,0,1182.6,"bookbinder"
908,"Keane, Mr. Daniel","male",35.0,0,0,915.36,"cabinetmaker"
909,"Assaf, Mr. Gerios","male",21.0,0,0,174.76,"barber"
910,"Ilmakangas, Miss. Ida Livija","female",27.0,1,0,397.81,"shoemaker"
911,"Assaf Khalil, Mrs. Mariana (Miriam)","female",45.0,0,0,46.06,"barber"
912,"Rothschild, Mr. Martin","male",55.0,1,0,3739.84,"dentist"
913,"Olsen, Master. Artur Karl","male",9.0,0,1,170.71,"wheelwright"
915,"Williams, Mr. Richard Norris II","male",21.0,0,1,4698.78,"doctor"
916,"Ryerson, Mrs. Arthur Larned (Emily Maria Borie)","female",48.0,1,3,2734.46,"surgeon"
917,"Robins, Mr. Alexander A","male",50.0,1,0,222.81,"wheelwright"
918,"Ostby, Miss. Helene Ragnhild","female",22.0,0,1,4962.37,"hatter"
919,"Daher, Mr. Shedid","male",22.5,0,0,364.27,"shoemaker"
920,"Brady, Mr. John Bertram","male",41.0,0,0,3707.98,"goldsmith"
921,"Samaan, Mr. Elias","male",,2,0,18.99,"wheelwright"
922,"Louch, Mr. Charles Alexander","male",50.0,1,0,1740.75,"shopkeeper"
923,"Jefferys, Mr. Clifford Thomas","male",24.0,2,0,1710.24,"hatter"
924,"Dean, Mrs. Bertram (Eva Georgetta Light)","female",33.0,1,2,317.37,"blacksmith"
925,"Johnston, Mrs. Andrew G (Elizabeth Lily Watson)","female",,1,2,104.66,"blacksmith"
926,"Mock, Mr. Philipp Edmund","male",30.0,1,0,4262.04,"surgeon"
927,"Katavelas, Mr. Vassilios (Catavelas Vassilios)","male",18.5,0,0,235.25,"wheelwright"
928,"Roth, Miss. Sarah A","female",,0,0,258.48,"blacksmith"
929,"Cacic, Miss. Manda","female",21.0,0,0,368.25,"weaver"
930,"Sap, Mr. Julius","male",25.0,0,0,247.9,"wigmaker"
931,"Hee, Mr. Ling","male",,0,0,133.88,"blacksmith"
932,"Karun, Mr. Franz","male",39.0,0,1,187.52,"barber"
933,"Franklin, Mr. Thomas Parham","male",,0,0,2388.42,"apothecary"
934,"Goldsmith, Mr. Nathan","male",41.0,0,0,308.42,"wheelwright"
935,"Corbett, Mrs. Walter H (Irene Colvin)","female",30.0,0,0,1773.74,"cutler"
936,"Kimball, Mrs. Edwin Nelson Jr (Gertrude Parsons)","female",45.0,1,0,2440.16,"farrier"
937,"Peltomaki, Mr. Nikolai Johannes","male",25.0,0,0,358.08,"blacksmith"
938,"Chevre, Mr. Paul Romaine","male",45.0,0,0,3861.66,"farrier"
939,"Shaughnessy, Mr. Patrick","male",,0,0,274.33,"blacksmith"
940,"Bucknell, Mrs. William Robert (Emma Eliza Ward)","female",60.0,0,0,4484.8,"pharmacist"
941,"Coutts, Mrs. William (Winnie Minnie Treanor)","female",36.0,0,2,229.71,"wheelwright"
942,"Smith, Mr. Lucien Philip","male",24.0,1,0,2172.74,"hatter"
943,"Pulbaum, Mr. Franz","male",27.0,0,0,1291.78,"cutler"
944,"Hocking, Miss. Ellen Nellie","female",20.0,2,1,1206.38,"coachmaker"
945,"Fortune, Miss. Ethel Flora","female",28.0,3,2,3785.84,"pharmacist"
946,"Mangiavacchi, Mr. Serafino Emilio","male",,0,0,611.99,"carpenter-joiner"
947,"Rice, Master. Albert","male",10.0,4,1,208.61,"barber"
948,"Cor, Mr. Bartol","male",35.0,0,0,45.42,"blacksmith"
949,"Abelseth, Mr. Olaus Jorgensen","male",25.0,0,0,156.98,"barber"
950,"Davison, Mr. Thomas Henry","male",,1,0,231.23,"wigmaker"
951,"Chaudanson, Miss. Victorine","female",36.0,0,0,3570.4,"pharmacist"
952,"Dika, Mr. Mirko","male",17.0,0,0,232.75,"weaver"
953,"McCrae, Mr. Arthur Gordon","male",32.0,0,0,938.01,"shopkeeper"
954,"Bjorklund, Mr. Ernst Herbert","male",18.0,0,0,316.95,"wheelwright"
955,"Bradley, Miss. Bridget Delia","female",22.0,0,0,153.96,"weaver"
957,"Corey, Mrs. Percy C (Mary Phyllis Elizabeth Miller)","female",,0,0,1909.01,"coachmaker"
958,"Burns, Miss. Mary Delia","female",18.0,0,0,369.92,"weaver"
959,"Moore, Mr. Clarence Bloomfield","male",47.0,0,0,4919.55,"apothecary"
960,"Tucker, Mr. Gilbert Milligan Jr","male",31.0,0,0,3600.23,"apothecary"
961,"Fortune, Mrs. Mark (Mary McDougald)","female",60.0,1,4,4485.16,"hatter"
962,"Mulvihill, Miss. Bertha E","female",24.0,0,0,66.95,"wigmaker"
963,"Minkoff, Mr. Lazar","male",21.0,0,0,354.89,"wheelwright"
964,"Nieminen, Miss. Manta Josefina","female",29.0,0,0,55.88,"barber"
965,"Ovies y Rodriguez, Mr. Servando","male",28.5,0,0,2458.52,"farrier"
966,"Geiger, Miss. Amalie","female",35.0,0,0,4499.63,"hatter"
967,"Keeping, Mr. Edwin","male",32.5,0,0,3208.88,"dentist"
968,"Miles, Mr. Frank","male",,0,0,154.93,"wheelwright"
969,"Cornell, Mrs. Robert Clifford (Malvina Helen Lamson)","female",55.0,2,0,2786.45,"apothecary"
970,"Aldworth, Mr. Charles Augustus","male",30.0,0,0,1667.79,"coachmaker"
971,"Doyle, Miss. Elizabeth","female",24.0,0,0,199.8,"weaver"
972,"Boulos, Master. Akar","male",6.0,1,1,146.93,"barber"
973,"Straus, Mr. Isidor","male",67.0,1,0,2642.98,"pharmacist"
974,"Case, Mr. Howard Brown","male",49.0,0,0,3384.6,"doctor"
975,"Demetri, Mr. Marinko","male",,0,0,23.51,"blacksmith"
976,"Lamb, Mr. John Joseph","male",,0,0,1517.72,"silversmith"
977,"Khalil, Mr. Betros","male",,1,0,334.5,"shoemaker"
978,"Barry, Miss. Julia","female",27.0,0,0,245.68,"weaver"
979,"Badman, Miss. Emily Louisa","female",18.0,0,0,86.72,"wheelwright"
980,"O'Donoghue, Ms. Bridget","female",,0,0,70.33,"shoemaker"
981,"Wells, Master. Ralph Lester","male",2.0,1,1,1903.89,"shopkeeper"
982,"Dyker, Mrs. Adolf Fredrik (Anna Elisabeth Judith Andersson)","female",22.0,1,0,180.49,"blacksmith"
983,"Pedersen, Mr. Olaf","male",,0,0,297.65,"shoemaker"
984,"Davidson, Mrs. Thornton (Orian Hays)","female",27.0,1,2,2206.14,"apothecary"
985,"Guest, Mr. Robert","male",,0,0,66.14,"weaver"
986,"Birnbaum, Mr. Jakob","male",25.0,0,0,4532.67,"dentist"
987,"Tenglin, Mr. Gunnar Isidor","male",25.0,0,0,70.46,"shoemaker"
988,"Cavendish, Mrs. Tyrell William (Julia Florence Siegel)","female",76.0,1,0,4432.97,"dentist"
989,"Makinen, Mr. Kalle Edvard","male",29.0,0,0,69.75,"blacksmith"
990,"Braf, Miss. Elin Ester Maria","female",20.0,0,0,216.38,"shoemaker"
991,"Nancarrow, Mr. William Henry","male",33.0,0,0,59.87,"barber"
992,"Stengel, Mrs. Charles Emil Henry (Annie May Morris)","female",43.0,1,0,3299.68,"hatter"
993,"Weisz, Mr. Leopold","male",27.0,1,0,1059.09,"carpenter-joiner"
994,"Foley, Mr. William","male",,0,0,161.54,"blacksmith"
995,"Johansson Palmquist, Mr. Oskar Leander","male",26.0,0,0,145.55,"blacksmith"
996,"Thomas, Mrs. Alexander (Thamine Thelma)","female",16.0,1,1,150.52,"blacksmith"
997,"Holthen, Mr. Johan Martin","male",28.0,0,0,245.03,"blacksmith"
998,"Buckley, Mr. Daniel","male",21.0,0,0,286.19,"wigmaker"
999,"Ryan, Mr. Edward","male",,0,0,220.95,"wheelwright"
1000,"Willer, Mr. Aaron (Abi Weller)","male",,0,0,399.63,"wheelwright"
1001,"Swane, Mr. George","male",18.5,0,0,849.8,"breechesmaker"
1002,"Stanton, Mr. Samuel Ward","male",41.0,0,0,665.84,"bookbinder"
1003,"Shine, Miss. Ellen Natalia","female",,0,0,68.98,"shoemaker"
1004,"Evans, Miss. Edith Corse","female",36.0,0,0,3521.61,"surgeon"
1005,"Buckley, Miss. Katherine","female",18.5,0,0,150.16,"blacksmith"
1006,"Straus, Mrs. Isidor (Rosalie Ida Blun)","female",63.0,1,0,3076.53,"dentist"
1007,"Chronopoulos, Mr. Demetrios","male",18.0,1,0,273.55,"wigmaker"
1008,"Thomas, Mr. John","male",,0,0,288.74,"blacksmith"
1009,"Sandstrom, Miss. Beatrice Irene","female",1.0,1,1,85.91,"weaver"
1011,"Chapman, Mrs. John Henry (Sara Elizabeth Lawry)","female",29.0,1,0,900.07,"bookbinder"
1012,"Watt, Miss. Bertha J","female",12.0,0,0,1094.12,"hatter"
1013,"Kiernan, Mr. John","male",,1,0,306.03,"wheelwright"
1014,"Schabert, Mrs. Paul (Emma Mock)","female",35.0,1,0,4738.95,"surgeon"
1015,"Carver, Mr. Alfred John","male",28.0,0,0,124.44,"wigmaker"
1016,"Kennedy, Mr. John","male",,0,0,257.91,"blacksmith"
1017,"Cribb, Miss. Laura Alice","female",17.0,0,1,2.03,"blacksmith"
1018,"Brobeck, Mr. Karl Rudolf","male",22.0,0,0,380.77,"weaver"
1019,"McCoy, Miss. Alicia","female",,2,0,44.05,"wheelwright"
1020,"Bowenur, Mr. Solomon","male",42.0,0,0,1716.14,"cutler"
1021,"Petersen, Mr. Marius","male",24.0,0,0,50.94,"barber"
1022,"Spinner, Mr. Henry John","male",32.0,0,0,175.19,"wigmaker"
1023,"Gracie, Col. Archibald IV","male",53.0,0,0,4502.92,"farrier"
1024,"Lefebre, Mrs. Frank (Frances)","female",,0,4,369.99,"shoemaker"
1025,"Thomas, Mr. Charles P","male",,1,0,164.69,"shoemaker"
1026,"Dintcheff, Mr. Valtcho","male",43.0,0,0,323.95,"barber"
1027,"Carlsson, Mr. Carl Robert","male",24.0,0,0,156.69,"wigmaker"
1028,"Zakarian, Mr. Mapriededer","male",26.5,0,0,262.27,"weaver"
1029,"Schmidt, Mr. August","male",26.0,0,0,1359.52,"shopkeeper"
1031,"Goodwin, Mr. Charles Frederick","male",40.0,1,6,93.59,"barber"
1032,"Goodwin, Miss. Jessie Allis","female",10.0,5,2,281.74,"blacksmith"
1033,"Daniels, Miss. Sarah","female",33.0,0,0,2255.86,"hatter"
1034,"Ryerson, Mr. Arthur Larned","male",61.0,1,3,4209.3,"music teacher"
1035,"Beauchamp, Mr. Henry James","male",28.0,0,0,1780.5,"shopkeeper"
1036,"Lindeberg-Lind, Mr. Erik Gustaf (Mr Edward Lingrey)","male",42.0,0,0,3160.58,"hatter"
1037,"Vander Planke, Mr. Julius","male",31.0,3,0,355.46,"barber"
1038,"Hilliard, Mr. Herbert Henry","male",,0,0,3652.43,"apothecary"
1039,"Davies, Mr. Evan","male",22.0,0,0,270.83,"shoemaker"
1040,"Crafton, Mr. John Bertram","male",,0,0,2724.62,"dentist"
1041,"Lahtinen, Rev. William","male",30.0,1,1,1833.18,"hatter"
1042,"Earnshaw, Mrs. Boulton (Olive Potter)","female",23.0,0,1,3055.4,"apothecary"
1043,"Matinoff, Mr. Nicola","male",,0,0,234.41,"weaver"
1044,"Storey, Mr. Thomas","male",60.5,0,0,38.56,"blacksmith"
1045,"Klasen, Mrs. (Hulda Kristina Eugenia Lofqvist)","female",36.0,0,2,127.99,"wheelwright"
1046,"Asplund, Master. Filip Oscar","male",13.0,4,2,204.52,"blacksmith"
1047,"Duquemin, Mr. Joseph","male",24.0,0,0,123.69,"blacksmith"
1048,"Bird, Miss. Ellen","female",29.0,0,0,4082.02,"doctor"
1049,"Lundin, Miss. Olga Elida","female",23.0,0,0,204.7,"shoemaker"
1050,"Borebank, Mr. John James","male",42.0,0,0,2792.02,"doctor"
1051,"Peacock, Mrs. Benjamin (Edith Nile)","female",26.0,0,2,10.03,"wigmaker"
1052,"Smyth, Miss. Julia","female",,0,0,63.9,"wigmaker"
1053,"Touma, Master. Georges Youssef","male",7.0,1,1,82.96,"shoemaker"
1054,"Wright, Miss. Marion","female",26.0,0,0,1596.81,"carpenter-joiner"
1055,"Pearce, Mr. Ernest","male",,0,0,372.37,"wheelwright"
1056,"Peruschitz, Rev. Joseph Maria","male",41.0,0,0,743.62,"breechesmaker"
1057,"Kink-Heilmann, Mrs. Anton (Luise Heilmann)","female",26.0,1,1,180.84,"weaver"
1058,"Brandeis, Mr. Emil","male",48.0,0,0,3526.62,"doctor"
1059,"Ford, Mr. Edward Watson","male",18.0,2,2,174.75,"barber"
1060,"Cassebeer, Mrs. Henry Arthur Jr (Eleanor Genevieve Fosdick)","female",,0,0,3686.72,"goldsmith"
1061,"Hellstrom, Miss. Hilda Maria","female",22.0,0,0,288.06,"shoemaker"
1062,"Lithman, Mr. Simon","male",,0,0,10.03,"wigmaker"
1063,"Zakarian, Mr. Ortin","male",27.0,0,0,208.04,"shoemaker"
1064,"Dyker, Mr. Adolf Fredrik","male",23.0,1,0,86.23,"weaver"
1065,"Torfa, Mr. Assad","male",,0,0,228.23,"wigmaker"
1066,"Asplund, Mr. Carl Oscar Vilhelm Gustafsson","male",40.0,1,5,152.26,"shoemaker"
1067,"Brown, Miss. Edith Eileen","female",15.0,0,2,1283.2,"carpenter-joiner"
1068,"Sincock, Miss. Maude","female",20.0,0,0,1455.74,"cabinetmaker"
1069,"Stengel, Mr. Charles Emil Henry","male",54.0,1,0,3357.5,"doctor"
1070,"Becker, Mrs. Allen Oliver (Nellie E Baumgardner)","female",36.0,0,3,1728.17,"cabinetmaker"
1071,"Compton, Mrs. Alexander Taylor (Mary Eliza Ingersoll)","female",64.0,0,2,3120.37,"apothecary"
1072,"McCrie, Mr. James Matthew","male",30.0,0,0,558.07,"cabinetmaker"
1073,"Compton, Mr. Alexander Taylor Jr","male",37.0,1,1,2749.2,"farrier"
1074,"Marvin, Mrs. Daniel Warner (Mary Graham Carmichael Farquarson)","female",18.0,1,0,2752.13,"hatter"
1075,"Lane, Mr. Patrick","male",,0,0,39.81,"wigmaker"
1076,"Douglas, Mrs. Frederick Charles (Mary Helene Baxter)","female",27.0,1,1,2281.21,"dentist"
1077,"Maybery, Mr. Frank Hubert","male",40.0,0,0,1112.77,"bookbinder"
1078,"Phillips, Miss. Alice Frances Louisa","female",21.0,0,1,1724.87,"coachmaker"
1079,"Davies, Mr. Joseph","male",17.0,2,0,214.24,"weaver"
1080,"Sage, Miss. Ada","female",,8,2,96.02,"shoemaker"
1081,"Veal, Mr. James","male",40.0,0,0,1488.78,"hatter"
1082,"Angle, Mr. William A","male",34.0,1,0,1377.25,"breechesmaker"
1083,"Salomon, Mr. Abraham L","male",,0,0,2967.54,"surgeon"
1084,"van Billiard, Master. Walter John","male",11.5,1,1,126.3,"blacksmith"
1085,"Lingane, Mr. John","male",61.0,0,0,1532.46,"carpenter-joiner"
1086,"Drew, Master. Marshall Brines","male",8.0,0,2,754.71,"cutler"
1087,"Karlsson, Mr. Julius Konrad Eugen","male",33.0,0,0,249.93,"shoemaker"
1088,"Spedden, Master. Robert Douglas","male",6.0,0,2,3876.8,"pharmacist"
1089,"Nilsson, Miss. Berta Olivia","female",18.0,0,0,356.78,"blacksmith"
1090,"Baimbrigge, Mr. Charles Robert","male",23.0,0,0,1210.35,"coachmaker"
1091,"Rasmussen, Mrs. (Lena Jacobsen Solvang)","female",,0,0,333.27,"blacksmith"
1092,"Murphy, Miss. Nora","female",,0,0,288.52,"shoemaker"
1093,"Danbom, Master. Gilbert Sigvard Emanuel","male",0.33,0,2,392.27,"blacksmith"
1094,"Astor, Col. John Jacob","male",47.0,1,0,2461.24,"hatter"
1095,"Quick, Miss. Winifred Vera","female",8.0,1,1,1141.17,"cutler"
1096,"Andrew, Mr. Frank Thomas","male",25.0,0,0,600.86,"carpenter-joiner"
1097,"Omont, Mr. Alfred Fernand","male",,0,0,3684.62,"hatter"
1098,"McGowan, Miss. Katherine","female",35.0,0,0,349.79,"wigmaker"
1099,"Collett, Mr. Sidney C Stuart","male",24.0,0,0,770.56,"breechesmaker"
1100,"Rosenbaum, Miss. Edith Louise","female",33.0,0,0,3214.91,"surgeon"
1101,"Delalic, Mr. Redjo","male",25.0,0,0,209.82,"blacksmith"
1102,"Andersen, Mr. Albert Karvin","male",32.0,0,0,244.36,"wheelwright"
1103,"Finoli, Mr. Luigi","male",,0,0,287.58,"wigmaker"
1104,"Deacon, Mr. Percy William","male",17.0,0,0,1824.24,"cutler"
1105,"Howard, Mrs. Benjamin (Ellen Truelove Arman)","female",60.0,1,0,1554.07,"breechesmaker"
1106,"Andersson, Miss. Ida Augusta Margareta","female",38.0,4,2,378.94,"wheelwright"
1107,"Head, Mr. Christopher","male",42.0,0,0,2248.51,"dentist"
1108,"Mahon, Miss. Bridget Delia","female",,0,0,172.72,"blacksmith"
1109,"Wick, Mr. George Dennick","male",57.0,1,1,2434.92,"music teacher"
1110,"Widener, Mrs. George Dunton (Eleanor Elkins)","female",50.0,1,1,4130.75,"goldsmith"
1111,"Thomson, Mr. Alexander Morrison","male",,0,0,289.43,"blacksmith"
1112,"Duran y More, Miss. Florentina","female",30.0,1,0,1268.6,"coachmaker"
1113,"Reynolds, Mr. Harold J","male",21.0,0,0,395.29,"barber"
1114,"Cook, Mrs. (Selena Rogers)","female",22.0,0,0,1161.29,"cabinetmaker"
1115,"Karlsson, Mr. Einar Gervasius","male",21.0,0,0,79.76,"wigmaker"
1116,"Candee, Mrs. Edward (Helen Churchill Hungerford)","female",53.0,0,0,2111.0,"music teacher"
1117,"Moubarek, Mrs. George (Omine Amenia Alexander)","female",,0,2,296.6,"wigmaker"
1118,"Asplund, Mr. Johan Charles","male",23.0,0,0,41.83,"blacksmith"
1119,"McNeill, Miss. Bridget","female",,0,0,392.06,"blacksmith"
1120,"Everett, Mr. Thomas James","male",40.5,0,0,257.3,"barber"
1121,"Hocking, Mr. Samuel James Metcalfe","male",36.0,0,0,1682.96,"shopkeeper"
1122,"Sweet, Mr. George Frederick","male",14.0,0,0,632.39,"cutler"
1123,"Willard, Miss. Constance","female",21.0,0,0,4189.57,"apothecary"
1124,"Wiklund, Mr. Karl Johan","male",21.0,1,0,395.48,"weaver"
1125,"Linehan, Mr. Michael","male",,0,0,159.58,"weaver"
1126,"Cumings, Mr. John Bradley","male",39.0,1,0,4163.11,"apothecary"
1127,"Vendel, Mr. Olof Edvin","male",20.0,0,0,4.03,"shoemaker"
1128,"Warren, Mr. Frank Manley","male",64.0,1,0,2847.63,"farrier"
1129,"Baccos, Mr. Raffull","male",20.0,0,0,63.11,"wigmaker"
1130,"Hiltunen, Miss. Marta","female",18.0,1,1,1849.73,"breechesmaker"
1131,"Douglas, Mrs. Walter Donald (Mahala Dutton)","female",48.0,1,0,4552.58,"farrier"
1132,"Lindstrom, Mrs. Carl Johan (Sigrid Posse)","female",55.0,0,0,4355.94,"surgeon"
1133,"Christy, Mrs. (Alice Frances)","female",45.0,0,2,1339.44,"breechesmaker"
1134,"Spedden, Mr. Frederic Oakley","male",45.0,1,1,4708.74,"farrier"
1135,"Hyman, Mr. Abraham","male",,0,0,176.51,"weaver"
1136,"Johnston, Master. William Arthur Willie","male",,1,2,321.4,"shoemaker"
1137,"Kenyon, Mr. Frederick R","male",41.0,1,0,4888.13,"dentist"
1138,"Karnes, Mrs. J Frank (Claire Bennett)","female",22.0,0,0,741.77,"coachmaker"
1139,"Drew, Mr. James Vivian","male",42.0,1,1,737.97,"bookbinder"
1140,"Hold, Mrs. Stephen (Annie Margaret Hill)","female",29.0,1,0,1873.02,"silversmith"
1141,"Khalil, Mrs. Betros (Zahie Maria Elias)","female",,1,0,181.13,"shoemaker"
1142,"West, Miss. Barbara J","female",0.92,1,2,1571.75,"breechesmaker"
1143,"Abrahamsson, Mr. Abraham August Johannes","male",20.0,0,0,335.37,"wigmaker"
1144,"Clark, Mr. Walter Miller","male",27.0,1,0,2015.75,"farrier"
1145,"Salander, Mr. Karl Johan","male",24.0,0,0,385.28,"wigmaker"
1146,"Wenzel, Mr. Linhart","male",32.5,0,0,144.16,"weaver"
