"PassengerId","Name","Sex","Age","SibSp","Parch","Salary","Job","Survived","Ticket","Fare","Cabin","Embarked"
847,"Sage, Mr. Douglas Bullen","male",28,8,2,180.26,"barber","Dead","CA. 2343",66.62505,"U","S"
848,"Markoff, Mr. Marin","male",35,0,0,73.72,"weaver","Dead","349213",7.8958,"U","C"
849,"Harper, Rev. John","male",28,0,1,1635.9,"breechesmaker","Dead","248727",33,"U","S"
850,"Goldenberg, Mrs. Samuel L (Edwiga Grabowska)","female",28,1,0,4268.14,"hatter","Alive","17453",66.62505,"C92","C"
851,"Andersson, Master. Sigvard Harald Elias","male",4,4,2,339.49,"blacksmith","Dead","347082",31.275,"U","S"
852,"Svensson, Mr. Johan","male",54.5,0,0,331.05,"wheelwright","Dead","347060",7.775,"U","S"
853,"Boulos, Miss. Nourelain","female",9,1,1,275.69,"barber","Dead","2678",15.2458,"U","C"
854,"Lines, Miss. Mary Conover","female",16,0,1,4351.27,"farrier","Alive","PC 17592",39.4,"D28","S"
855,"Carter, Mrs. Ernest Courtenay (Lilian Hughes)","female",44,1,0,613.24,"hatter","Dead","244252",26,"U","S"
856,"Aks, Mrs. Sam (Leah Rosen)","female",18,0,1,83.25,"wheelwright","Alive","392091",9.35,"U","S"
857,"Wick, Mrs. George Dennick (Mary Hitchcock)","female",45,1,1,4349.79,"music teacher","Alive","36928",66.62505,"U","S"
858,"Daly, Mr. Peter Denis","male",51,0,0,4825.21,"music teacher","Alive","113055",26.55,"E17","S"
859,"Baclini, Mrs. Solomon (Latifa Qurban)","female",24,0,3,43.95,"barber","Alive","2666",19.2583,"U","C"
860,"Razi, Mr. Raihed","male",28,0,0,248.78,"barber","Dead","2629",7.2292,"U","C"
861,"Hansen, Mr. Claus Peter","male",41,2,0,108.46,"wheelwright","Dead","350026",14.1083,"U","S"
862,"Giles, Mr. Frederick Edward","male",21,1,0,871.96,"cabinetmaker","Dead","28134",11.5,"U","S"
863,"Swift, Mrs. Frederick Joel (Margaret Welles Barron)","female",48,0,0,4444.25,"goldsmith","Alive","17466",25.9292,"D17","S"
864,"Sage, Miss. Dorothy Edith Dolly","female",28,8,2,332.37,"barber","Dead","CA. 2343",66.62505,"U","S"
865,"Gill, Mr. John William","male",24,0,0,594.44,"shopkeeper","Dead","233866",13,"U","S"
866,"Bystrom, Mrs. (Karolina)","female",42,0,0,1227.51,"carpenter-joiner","Alive","236852",13,"U","S"
867,"Duran y More, Miss. Asuncion","female",27,1,0,1259.14,"carpenter-joiner","Alive","SC/PARIS 2149",13.8583,"U","C"
868,"Roebling, Mr. Washington Augustus II","male",31,0,0,4447.86,"apothecary","Dead","PC 17590",50.4958,"A24","S"
869,"van Melkebeke, Mr. Philemon","male",28,0,0,18.71,"wigmaker","Dead","345777",9.5,"U","S"
870,"Johnson, Master. Harold Theodor","male",4,1,1,205.19,"weaver","Alive","347742",11.1333,"U","S"
871,"Balkic, Mr. Cerin","male",26,0,0,283.29,"wheelwright","Dead","349248",7.8958,"U","S"
872,"Beckwith, Mrs. Richard Leonard (Sallie Monypeny)","female",47,1,1,3147,"farrier","Alive","11751",52.5542,"D35","S"
873,"Carlsson, Mr. Frans Olof","male",33,0,0,3831.18,"goldsmith","Dead","695",5,"B51 B53 B55","S"
874,"Vander Cruyssen, Mr. Victor","male",47,0,0,316.63,"wigmaker","Dead","345765",9,"U","S"
876,"Najib, Miss. Adele Kiamie Jane","female",15,0,0,8.87,"wigmaker","Alive","2667",7.225,"U","C"
877,"Gustafsson, Mr. Alfred Ossian","male",20,0,0,393.28,"blacksmith","Dead","7534",9.8458,"U","S"
878,"Petroff, Mr. Nedelio","male",19,0,0,190.59,"wigmaker","Dead","349212",7.8958,"U","S"
879,"Laleff, Mr. Kristo","male",28,0,0,248.57,"wigmaker","Dead","349217",7.8958,"U","S"
880,"Potter, Mrs. Thomas Jr (Lily Alexenia Wilson)","female",54.5,0,1,2422.99,"pharmacist","Alive","11767",66.62505,"C50","C"
881,"Shelley, Mrs. William (Imanita Parrish Hall)","female",25,0,1,840.66,"shopkeeper","Alive","230433",26,"U","S"
882,"Markun, Mr. Johann","male",33,0,0,219.78,"shoemaker","Dead","349257",7.8958,"U","S"
883,"Dahlberg, Miss. Gerda Ulrika","female",22,0,0,243.1,"wheelwright","Dead","7552",10.5167,"U","S"
884,"Banfield, Mr. Frederick James","male",28,0,0,564.7,"hatter","Dead","C.A./SOTON 34068",10.5,"U","S"
885,"Sutehall, Mr. Henry Jr","male",25,0,0,110.29,"blacksmith","Dead","SOTON/OQ 392076",7.05,"U","S"
886,"Rice, Mrs. William (Margaret Norton)","female",39,0,5,58.51,"blacksmith","Dead","382652",29.125,"U","Q"
887,"Montvila, Rev. Juozas","male",27,0,0,452.78,"silversmith","Dead","211536",13,"U","S"
889,"Johnston, Miss. Catherine Helen Carrie","female",28,1,2,300.66,"blacksmith","Dead","W./C. 6607",23.45,"U","S"
890,"Behr, Mr. Karl Howell","male",26,0,0,2628.22,"apothecary","Alive","111369",30,"C148","C"
891,"Dooley, Mr. Patrick","male",32,0,0,200,"wheelwright","Dead","370376",7.75,"U","Q"
892,"Kelly, Mr. James","male",34.5,0,0,186.57,"barber","Dead","330911",7.8292,"U","Q"
893,"Wilkes, Mrs. James (Ellen Needs)","female",47,1,0,366.84,"barber","Alive","363272",7,"U","S"
894,"Myles, Mr. Thomas Francis","male",54.5,0,0,1498.06,"shopkeeper","Dead","240276",9.6875,"U","Q"
895,"Wirz, Mr. Albert","male",27,0,0,298.59,"weaver","Dead","315154",8.6625,"U","S"
896,"Hirvonen, Mrs. Alexander (Helga E Lindqvist)","female",22,1,1,349.43,"weaver","Alive","3101298",12.2875,"U","S"
897,"Svensson, Mr. Johan Cervin","male",14,0,0,341.41,"blacksmith","Dead","7538",9.225,"U","S"
898,"Connolly, Miss. Kate","female",30,0,0,341.44,"blacksmith","Alive","330972",7.6292,"U","Q"
899,"Caldwell, Mr. Albert Francis","male",26,1,1,878.04,"cutler","Dead","248738",29,"U","S"
900,"Abrahim, Mrs. Joseph (Sophie Halaut Easu)","female",18,0,0,200.48,"blacksmith","Alive","2657",7.2292,"U","C"
901,"Davies, Mr. John Samuel","male",21,2,0,41.13,"blacksmith","Dead","A/4 48871",24.15,"U","S"
902,"Ilieff, Mr. Ylio","male",28,0,0,179.78,"blacksmith","Dead","349220",7.8958,"U","S"
903,"Jones, Mr. Charles Cresson","male",46,0,0,4047.87,"surgeon","Dead","694",26,"U","S"
904,"Snyder, Mrs. John Pillsbury (Nelle Stevenson)","female",23,1,0,2986.73,"music teacher","Alive","21228",66.62505,"B45","S"
905,"Howard, Mr. Benjamin","male",54.5,1,0,636.13,"coachmaker","Dead","24065",26,"U","S"
906,"Chaffee, Mrs. Herbert Fuller (Carrie Constance Toogood)","female",47,1,0,3781.84,"goldsmith","Alive","W.E.P. 5734",61.175,"E31","S"
907,"del Carlo, Mrs. Sebastiano (Argenia Genovesi)","female",24,1,0,1182.6,"bookbinder","Alive","SC/PARIS 2167",27.7208,"U","C"
908,"Keane, Mr. Daniel","male",35,0,0,915.36,"cabinetmaker","Dead","233734",12.35,"U","Q"
909,"Assaf, Mr. Gerios","male",21,0,0,174.76,"barber","Dead","2692",7.225,"U","C"
910,"Ilmakangas, Miss. Ida Livija","female",27,1,0,397.81,"shoemaker","Alive","STON/O2. 3101270",7.925,"U","S"
911,"Assaf Khalil, Mrs. Mariana (Miriam)","female",45,0,0,46.06,"barber","Alive","2696",7.225,"U","C"
912,"Rothschild, Mr. Martin","male",54.5,1,0,3739.84,"dentist","Dead","PC 17603",59.4,"U","C"
913,"Olsen, Master. Artur Karl","male",9,0,1,170.71,"wheelwright","Dead","C 17368",3.1708,"U","S"
915,"Williams, Mr. Richard Norris II","male",21,0,1,4698.78,"doctor","Dead","PC 17597",61.3792,"U","C"
916,"Ryerson, Mrs. Arthur Larned (Emily Maria Borie)","female",48,1,3,2734.46,"surgeon","Alive","PC 17608",66.62505,"B57 B59 B63 B66","C"
917,"Robins, Mr. Alexander A","male",50,1,0,222.81,"wheelwright","Dead","A/5. 3337",14.5,"U","S"
918,"Ostby, Miss. Helene Ragnhild","female",22,0,1,4962.37,"hatter","Alive","113509",61.9792,"B36","C"
919,"Daher, Mr. Shedid","male",22.5,0,0,364.27,"shoemaker","Dead","2698",7.225,"U","C"
920,"Brady, Mr. John Bertram","male",41,0,0,3707.98,"goldsmith","Dead","113054",30.5,"A21","S"
921,"Samaan, Mr. Elias","male",28,2,0,18.99,"wheelwright","Dead","2662",21.6792,"U","C"
922,"Louch, Mr. Charles Alexander","male",50,1,0,1740.75,"shopkeeper","Dead","SC/AH 3085",26,"U","S"
923,"Jefferys, Mr. Clifford Thomas","male",24,2,0,1710.24,"hatter","Dead","C.A. 31029",31.5,"U","S"
925,"Johnston, Mrs. Andrew G (Elizabeth Lily Watson)","female",28,1,2,104.66,"blacksmith","Alive","W./C. 6607",23.45,"U","S"
926,"Mock, Mr. Philipp Edmund","male",30,1,0,4262.04,"surgeon","Dead","13236",57.75,"C78","C"
927,"Katavelas, Mr. Vassilios (Catavelas Vassilios)","male",18.5,0,0,235.25,"wheelwright","Dead","2682",7.2292,"U","C"
928,"Roth, Miss. Sarah A","female",28,0,0,258.48,"blacksmith","Alive","342712",8.05,"U","S"
929,"Cacic, Miss. Manda","female",21,0,0,368.25,"weaver","Alive","315087",8.6625,"U","S"
930,"Sap, Mr. Julius","male",25,0,0,247.9,"wigmaker","Dead","345768",9.5,"U","S"
931,"Hee, Mr. Ling","male",28,0,0,133.88,"blacksmith","Dead","1601",56.4958,"U","S"
932,"Karun, Mr. Franz","male",39,0,1,187.52,"barber","Dead","349256",13.4167,"U","C"
933,"Franklin, Mr. Thomas Parham","male",28,0,0,2388.42,"apothecary","Dead","113778",26.55,"D34","S"
934,"Goldsmith, Mr. Nathan","male",41,0,0,308.42,"wheelwright","Dead","SOTON/O.Q. 3101263",7.85,"U","S"
935,"Corbett, Mrs. Walter H (Irene Colvin)","female",30,0,0,1773.74,"cutler","Alive","237249",13,"U","S"
936,"Kimball, Mrs. Edwin Nelson Jr (Gertrude Parsons)","female",45,1,0,2440.16,"farrier","Alive","11753",52.5542,"D19","S"
937,"Peltomaki, Mr. Nikolai Johannes","male",25,0,0,358.08,"blacksmith","Dead","STON/O 2. 3101291",7.925,"U","S"
938,"Chevre, Mr. Paul Romaine","male",45,0,0,3861.66,"farrier","Dead","PC 17594",29.7,"A9","C"
939,"Shaughnessy, Mr. Patrick","male",28,0,0,274.33,"blacksmith","Dead","370374",7.75,"U","Q"
940,"Bucknell, Mrs. William Robert (Emma Eliza Ward)","female",54.5,0,0,4484.8,"pharmacist","Alive","11813",66.62505,"D15","C"
941,"Coutts, Mrs. William (Winnie Minnie Treanor)","female",36,0,2,229.71,"wheelwright","Alive","C.A. 37671",15.9,"U","S"
942,"Smith, Mr. Lucien Philip","male",24,1,0,2172.74,"hatter","Dead","13695",60,"C31","S"
943,"Pulbaum, Mr. Franz","male",27,0,0,1291.78,"cutler","Dead","SC/PARIS 2168",15.0333,"U","C"
944,"Hocking, Miss. Ellen Nellie","female",20,2,1,1206.38,"coachmaker","Alive","29105",23,"U","S"
945,"Fortune, Miss. Ethel Flora","female",28,3,2,3785.84,"pharmacist","Alive","19950",66.62505,"C23 C25 C27","S"
946,"Mangiavacchi, Mr. Serafino Emilio","male",28,0,0,611.99,"carpenter-joiner","Dead","SC/A.3 2861",15.5792,"U","C"
947,"Rice, Master. Albert","male",10,4,1,208.61,"barber","Dead","382652",29.125,"U","Q"
949,"Abelseth, Mr. Olaus Jorgensen","male",25,0,0,156.98,"barber","Dead","348122",7.65,"F G63","S"
950,"Davison, Mr. Thomas Henry","male",28,1,0,231.23,"wigmaker","Dead","386525",16.1,"U","S"
951,"Chaudanson, Miss. Victorine","female",36,0,0,3570.4,"pharmacist","Alive","PC 17608",66.62505,"B61","C"
952,"Dika, Mr. Mirko","male",17,0,0,232.75,"weaver","Dead","349232",7.8958,"U","S"
953,"McCrae, Mr. Arthur Gordon","male",32,0,0,938.01,"shopkeeper","Dead","237216",13.5,"U","S"
954,"Bjorklund, Mr. Ernst Herbert","male",18,0,0,316.95,"wheelwright","Dead","347090",7.75,"U","S"
955,"Bradley, Miss. Bridget Delia","female",22,0,0,153.96,"weaver","Alive","334914",7.725,"U","Q"
957,"Corey, Mrs. Percy C (Mary Phyllis Elizabeth Miller)","female",28,0,0,1909.01,"coachmaker","Alive","F.C.C. 13534",21,"U","S"
958,"Burns, Miss. Mary Delia","female",18,0,0,369.92,"weaver","Alive","330963",7.8792,"U","Q"
959,"Moore, Mr. Clarence Bloomfield","male",47,0,0,4919.55,"apothecary","Dead","113796",42.4,"U","S"
960,"Tucker, Mr. Gilbert Milligan Jr","male",31,0,0,3600.23,"apothecary","Dead","2543",28.5375,"C53","C"
961,"Fortune, Mrs. Mark (Mary McDougald)","female",54.5,1,4,4485.16,"hatter","Alive","19950",66.62505,"C23 C25 C27","S"
963,"Minkoff, Mr. Lazar","male",21,0,0,354.89,"wheelwright","Dead","349211",7.8958,"U","S"
964,"Nieminen, Miss. Manta Josefina","female",29,0,0,55.88,"barber","Alive","3101297",7.925,"U","S"
965,"Ovies y Rodriguez, Mr. Servando","male",28.5,0,0,2458.52,"farrier","Dead","PC 17562",27.7208,"D43","C"
966,"Geiger, Miss. Amalie","female",35,0,0,4499.63,"hatter","Alive","113503",66.62505,"C130","C"
967,"Keeping, Mr. Edwin","male",32.5,0,0,3208.88,"dentist","Dead","113503",66.62505,"C132","C"
968,"Miles, Mr. Frank","male",28,0,0,154.93,"wheelwright","Dead","359306",8.05,"U","S"
969,"Cornell, Mrs. Robert Clifford (Malvina Helen Lamson)","female",54.5,2,0,2786.45,"apothecary","Alive","11770",25.7,"C101","S"
970,"Aldworth, Mr. Charles Augustus","male",30,0,0,1667.79,"coachmaker","Dead","248744",13,"U","S"
971,"Doyle, Miss. Elizabeth","female",24,0,0,199.8,"weaver","Alive","368702",7.75,"U","Q"
972,"Boulos, Master. Akar","male",6,1,1,146.93,"barber","Dead","2678",15.2458,"U","C"
973,"Straus, Mr. Isidor","male",54.5,1,0,2642.98,"pharmacist","Dead","PC 17483",66.62505,"C55 C57","S"
974,"Case, Mr. Howard Brown","male",49,0,0,3384.6,"doctor","Dead","19924",26,"U","S"
975,"Demetri, Mr. Marinko","male",28,0,0,23.51,"blacksmith","Dead","349238",7.8958,"U","S"
976,"Lamb, Mr. John Joseph","male",28,0,0,1517.72,"silversmith","Dead","240261",10.7083,"U","Q"
977,"Khalil, Mr. Betros","male",28,1,0,334.5,"shoemaker","Dead","2660",14.4542,"U","C"
978,"Barry, Miss. Julia","female",27,0,0,245.68,"weaver","Alive","330844",7.8792,"U","Q"
979,"Badman, Miss. Emily Louisa","female",18,0,0,86.72,"wheelwright","Alive","A/4 31416",8.05,"U","S"
981,"Wells, Master. Ralph Lester","male",2.5,1,1,1903.89,"shopkeeper","Dead","29103",23,"U","S"
982,"Dyker, Mrs. Adolf Fredrik (Anna Elisabeth Judith Andersson)","female",22,1,0,180.49,"blacksmith","Alive","347072",13.9,"U","S"
983,"Pedersen, Mr. Olaf","male",28,0,0,297.65,"shoemaker","Dead","345498",7.775,"U","S"
984,"Davidson, Mrs. Thornton (Orian Hays)","female",27,1,2,2206.14,"apothecary","Alive","F.C. 12750",52,"B71","S"
985,"Guest, Mr. Robert","male",28,0,0,66.14,"weaver","Dead","376563",8.05,"U","S"
986,"Birnbaum, Mr. Jakob","male",25,0,0,4532.67,"dentist","Dead","13905",26,"U","C"
987,"Tenglin, Mr. Gunnar Isidor","male",25,0,0,70.46,"shoemaker","Dead","350033",7.7958,"U","S"
988,"Cavendish, Mrs. Tyrell William (Julia Florence Siegel)","female",54.5,1,0,4432.97,"dentist","Alive","19877",66.62505,"C46","S"
989,"Makinen, Mr. Kalle Edvard","male",29,0,0,69.75,"blacksmith","Dead","STON/O 2. 3101268",7.925,"U","S"
990,"Braf, Miss. Elin Ester Maria","female",20,0,0,216.38,"shoemaker","Alive","347471",7.8542,"U","S"
991,"Nancarrow, Mr. William Henry","male",33,0,0,59.87,"barber","Dead","A./5. 3338",8.05,"U","S"
992,"Stengel, Mrs. Charles Emil Henry (Annie May Morris)","female",43,1,0,3299.68,"hatter","Alive","11778",55.4417,"C116","C"
993,"Weisz, Mr. Leopold","male",27,1,0,1059.09,"carpenter-joiner","Dead","228414",26,"U","S"
994,"Foley, Mr. William","male",28,0,0,161.54,"blacksmith","Dead","365235",7.75,"U","Q"
995,"Johansson Palmquist, Mr. Oskar Leander","male",26,0,0,145.55,"blacksmith","Dead","347070",7.775,"U","S"
996,"Thomas, Mrs. Alexander (Thamine Thelma)","female",16,1,1,150.52,"blacksmith","Alive","2625",8.5167,"U","C"
997,"Holthen, Mr. Johan Martin","male",28,0,0,245.03,"blacksmith","Dead","C 4001",22.525,"U","S"
998,"Buckley, Mr. Daniel","male",21,0,0,286.19,"wigmaker","Dead","330920",7.8208,"U","Q"
999,"Ryan, Mr. Edward","male",28,0,0,220.95,"wheelwright","Dead","383162",7.75,"U","Q"
1000,"Willer, Mr. Aaron (Abi Weller)","male",28,0,0,399.63,"wheelwright","Dead","3410",8.7125,"U","S"
1003,"Shine, Miss. Ellen Natalia","female",28,0,0,68.98,"shoemaker","Alive","330968",7.7792,"U","Q"
1004,"Evans, Miss. Edith Corse","female",36,0,0,3521.61,"surgeon","Alive","PC 17531",31.6792,"A29","C"
1005,"Buckley, Miss. Katherine","female",18.5,0,0,150.16,"blacksmith","Alive","329944",7.2833,"U","Q"
1006,"Straus, Mrs. Isidor (Rosalie Ida Blun)","female",54.5,1,0,3076.53,"dentist","Alive","PC 17483",66.62505,"C55 C57","S"
1007,"Chronopoulos, Mr. Demetrios","male",18,1,0,273.55,"wigmaker","Dead","2680",14.4542,"U","C"
1008,"Thomas, Mr. John","male",28,0,0,288.74,"blacksmith","Dead","2681",6.4375,"U","C"
1009,"Sandstrom, Miss. Beatrice Irene","female",2.5,1,1,85.91,"weaver","Alive","PP 9549",16.7,"G6","S"
1011,"Chapman, Mrs. John Henry (Sara Elizabeth Lawry)","female",29,1,0,900.07,"bookbinder","Alive","SC/AH 29037",26,"U","S"
1013,"Kiernan, Mr. John","male",28,1,0,306.03,"wheelwright","Dead","367227",7.75,"U","Q"
1014,"Schabert, Mrs. Paul (Emma Mock)","female",35,1,0,4738.95,"surgeon","Alive","13236",57.75,"C28","C"
1015,"Carver, Mr. Alfred John","male",28,0,0,124.44,"wigmaker","Dead","392095",7.25,"U","S"
1016,"Kennedy, Mr. John","male",28,0,0,257.91,"blacksmith","Dead","368783",7.75,"U","Q"
1017,"Cribb, Miss. Laura Alice","female",17,0,1,2.03,"blacksmith","Alive","371362",16.1,"U","S"
1018,"Brobeck, Mr. Karl Rudolf","male",22,0,0,380.77,"weaver","Dead","350045",7.7958,"U","S"
1019,"McCoy, Miss. Alicia","female",28,2,0,44.05,"wheelwright","Alive","367226",23.25,"U","Q"
1020,"Bowenur, Mr. Solomon","male",42,0,0,1716.14,"cutler","Dead","211535",13,"U","S"
1021,"Petersen, Mr. Marius","male",24,0,0,50.94,"barber","Dead","342441",8.05,"U","S"
1022,"Spinner, Mr. Henry John","male",32,0,0,175.19,"wigmaker","Dead","STON/OQ. 369943",8.05,"U","S"
1023,"Gracie, Col. Archibald IV","male",53,0,0,4502.92,"farrier","Dead","113780",28.5,"C51","C"
1024,"Lefebre, Mrs. Frank (Frances)","female",28,0,4,369.99,"shoemaker","Alive","4133",25.4667,"U","S"
1025,"Thomas, Mr. Charles P","male",28,1,0,164.69,"shoemaker","Dead","2621",6.4375,"U","C"
1026,"Dintcheff, Mr. Valtcho","male",43,0,0,323.95,"barber","Dead","349226",7.8958,"U","S"
1027,"Carlsson, Mr. Carl Robert","male",24,0,0,156.69,"wigmaker","Dead","350409",7.8542,"U","S"
1028,"Zakarian, Mr. Mapriededer","male",26.5,0,0,262.27,"weaver","Dead","2656",7.225,"U","C"
1029,"Schmidt, Mr. August","male",26,0,0,1359.52,"shopkeeper","Dead","248659",13,"U","S"
1031,"Goodwin, Mr. Charles Frederick","male",40,1,6,93.59,"barber","Dead","CA 2144",46.9,"U","S"
1033,"Daniels, Miss. Sarah","female",33,0,0,2255.86,"hatter","Alive","113781",66.62505,"U","S"
1034,"Ryerson, Mr. Arthur Larned","male",54.5,1,3,4209.3,"music teacher","Dead","PC 17608",66.62505,"B57 B59 B63 B66","C"
1036,"Lindeberg-Lind, Mr. Erik Gustaf (Mr Edward Lingrey)","male",42,0,0,3160.58,"hatter","Dead","17475",26.55,"U","S"
1037,"Vander Planke, Mr. Julius","male",31,3,0,355.46,"barber","Dead","345763",18,"U","S"
1038,"Hilliard, Mr. Herbert Henry","male",28,0,0,3652.43,"apothecary","Dead","17463",51.8625,"E46","S"
1039,"Davies, Mr. Evan","male",22,0,0,270.83,"shoemaker","Dead","SC/A4 23568",8.05,"U","S"
1040,"Crafton, Mr. John Bertram","male",28,0,0,2724.62,"dentist","Dead","113791",26.55,"U","S"
1041,"Lahtinen, Rev. William","male",30,1,1,1833.18,"hatter","Dead","250651",26,"U","S"
1042,"Earnshaw, Mrs. Boulton (Olive Potter)","female",23,0,1,3055.4,"apothecary","Alive","11767",66.62505,"C54","C"
1043,"Matinoff, Mr. Nicola","male",28,0,0,234.41,"weaver","Dead","349255",7.8958,"U","C"
1044,"Storey, Mr. Thomas","male",54.5,0,0,38.56,"blacksmith","Dead","3701",33.8084995012469,"U","S"
1046,"Asplund, Master. Filip Oscar","male",13,4,2,204.52,"blacksmith","Dead","347077",31.3875,"U","S"
1047,"Duquemin, Mr. Joseph","male",24,0,0,123.69,"blacksmith","Dead","S.O./P.P. 752",7.55,"U","S"
1048,"Bird, Miss. Ellen","female",29,0,0,4082.02,"doctor","Alive","PC 17483",66.62505,"C97","S"
1049,"Lundin, Miss. Olga Elida","female",23,0,0,204.7,"shoemaker","Alive","347469",7.8542,"U","S"
1050,"Borebank, Mr. John James","male",42,0,0,2792.02,"doctor","Dead","110489",26.55,"D22","S"
1051,"Peacock, Mrs. Benjamin (Edith Nile)","female",26,0,2,10.03,"wigmaker","Alive","SOTON/O.Q. 3101315",13.775,"U","S"
1052,"Smyth, Miss. Julia","female",28,0,0,63.9,"wigmaker","Alive","335432",7.7333,"U","Q"
1053,"Touma, Master. Georges Youssef","male",7,1,1,82.96,"shoemaker","Dead","2650",15.2458,"U","C"
1054,"Wright, Miss. Marion","female",26,0,0,1596.81,"carpenter-joiner","Alive","220844",13.5,"U","S"
1055,"Pearce, Mr. Ernest","male",28,0,0,372.37,"wheelwright","Dead","343271",7,"U","S"
1056,"Peruschitz, Rev. Joseph Maria","male",41,0,0,743.62,"breechesmaker","Dead","237393",13,"U","S"
1057,"Kink-Heilmann, Mrs. Anton (Luise Heilmann)","female",26,1,1,180.84,"weaver","Alive","315153",22.025,"U","S"
1058,"Brandeis, Mr. Emil","male",48,0,0,3526.62,"doctor","Dead","PC 17591",50.4958,"B10","C"
1059,"Ford, Mr. Edward Watson","male",18,2,2,174.75,"barber","Dead","W./C. 6608",34.375,"U","S"
1060,"Cassebeer, Mrs. Henry Arthur Jr (Eleanor Genevieve Fosdick)","female",28,0,0,3686.72,"goldsmith","Alive","17770",27.7208,"U","C"
1061,"Hellstrom, Miss. Hilda Maria","female",22,0,0,288.06,"shoemaker","Alive","7548",8.9625,"U","S"
1062,"Lithman, Mr. Simon","male",28,0,0,10.03,"wigmaker","Dead","S.O./P.P. 251",7.55,"U","S"
1063,"Zakarian, Mr. Ortin","male",27,0,0,208.04,"shoemaker","Dead","2670",7.225,"U","C"
1064,"Dyker, Mr. Adolf Fredrik","male",23,1,0,86.23,"weaver","Dead","347072",13.9,"U","S"
1065,"Torfa, Mr. Assad","male",28,0,0,228.23,"wigmaker","Dead","2673",7.2292,"U","C"
1066,"Asplund, Mr. Carl Oscar Vilhelm Gustafsson","male",40,1,5,152.26,"shoemaker","Dead","347077",31.3875,"U","S"
1067,"Brown, Miss. Edith Eileen","female",15,0,2,1283.2,"carpenter-joiner","Alive","29750",39,"U","S"
1068,"Sincock, Miss. Maude","female",20,0,0,1455.74,"cabinetmaker","Alive","C.A. 33112",36.75,"U","S"
1069,"Stengel, Mr. Charles Emil Henry","male",54,1,0,3357.5,"doctor","Dead","11778",55.4417,"C116","C"
1070,"Becker, Mrs. Allen Oliver (Nellie E Baumgardner)","female",36,0,3,1728.17,"cabinetmaker","Alive","230136",39,"F4","S"
1071,"Compton, Mrs. Alexander Taylor (Mary Eliza Ingersoll)","female",54.5,0,2,3120.37,"apothecary","Alive","PC 17756",66.62505,"E45","C"
1072,"McCrie, Mr. James Matthew","male",30,0,0,558.07,"cabinetmaker","Dead","233478",13,"U","S"
1073,"Compton, Mr. Alexander Taylor Jr","male",37,1,1,2749.2,"farrier","Dead","PC 17756",66.62505,"E52","C"
1074,"Marvin, Mrs. Daniel Warner (Mary Graham Carmichael Farquarson)","female",18,1,0,2752.13,"hatter","Alive","113773",53.1,"D30","S"
1075,"Lane, Mr. Patrick","male",28,0,0,39.81,"wigmaker","Dead","7935",7.75,"U","Q"
1076,"Douglas, Mrs. Frederick Charles (Mary Helene Baxter)","female",27,1,1,2281.21,"dentist","Alive","PC 17558",66.62505,"B58 B60","C"
1077,"Maybery, Mr. Frank Hubert","male",40,0,0,1112.77,"bookbinder","Dead","239059",16,"U","S"
1078,"Phillips, Miss. Alice Frances Louisa","female",21,0,1,1724.87,"coachmaker","Alive","S.O./P.P. 2",21,"U","S"
1079,"Davies, Mr. Joseph","male",17,2,0,214.24,"weaver","Dead","A/4 48873",8.05,"U","S"
1080,"Sage, Miss. Ada","female",28,8,2,96.02,"shoemaker","Alive","CA. 2343",66.62505,"U","S"
1081,"Veal, Mr. James","male",40,0,0,1488.78,"hatter","Dead","28221",13,"U","S"
1082,"Angle, Mr. William A","male",34,1,0,1377.25,"breechesmaker","Dead","226875",26,"U","S"
1083,"Salomon, Mr. Abraham L","male",28,0,0,2967.54,"surgeon","Dead","111163",26,"U","S"
1084,"van Billiard, Master. Walter John","male",11.5,1,1,126.3,"blacksmith","Dead","A/5. 851",14.5,"U","S"
1085,"Lingane, Mr. John","male",54.5,0,0,1532.46,"carpenter-joiner","Dead","235509",12.35,"U","Q"
1086,"Drew, Master. Marshall Brines","male",8,0,2,754.71,"cutler","Dead","28220",32.5,"U","S"
1087,"Karlsson, Mr. Julius Konrad Eugen","male",33,0,0,249.93,"shoemaker","Dead","347465",7.8542,"U","S"
1088,"Spedden, Master. Robert Douglas","male",6,0,2,3876.8,"pharmacist","Dead","16966",66.62505,"E34","C"
1089,"Nilsson, Miss. Berta Olivia","female",18,0,0,356.78,"blacksmith","Alive","347066",7.775,"U","S"
1090,"Baimbrigge, Mr. Charles Robert","male",23,0,0,1210.35,"coachmaker","Dead","C.A. 31030",10.5,"U","S"
1091,"Rasmussen, Mrs. (Lena Jacobsen Solvang)","female",28,0,0,333.27,"blacksmith","Alive","65305",8.1125,"U","S"
1092,"Murphy, Miss. Nora","female",28,0,0,288.52,"shoemaker","Alive","36568",15.5,"U","Q"
1093,"Danbom, Master. Gilbert Sigvard Emanuel","male",2.5,0,2,392.27,"blacksmith","Dead","347080",14.4,"U","S"
1094,"Astor, Col. John Jacob","male",47,1,0,2461.24,"hatter","Dead","PC 17757",66.62505,"C62 C64","C"
1095,"Quick, Miss. Winifred Vera","female",8,1,1,1141.17,"cutler","Alive","26360",26,"U","S"
1096,"Andrew, Mr. Frank Thomas","male",25,0,0,600.86,"carpenter-joiner","Dead","C.A. 34050",10.5,"U","S"
1097,"Omont, Mr. Alfred Fernand","male",28,0,0,3684.62,"hatter","Dead","F.C. 12998",25.7417,"U","C"
1098,"McGowan, Miss. Katherine","female",35,0,0,349.79,"wigmaker","Alive","9232",7.75,"U","Q"
1099,"Collett, Mr. Sidney C Stuart","male",24,0,0,770.56,"breechesmaker","Dead","28034",10.5,"U","S"
1100,"Rosenbaum, Miss. Edith Louise","female",33,0,0,3214.91,"surgeon","Alive","PC 17613",27.7208,"A11","C"
1101,"Delalic, Mr. Redjo","male",25,0,0,209.82,"blacksmith","Dead","349250",7.8958,"U","S"
1102,"Andersen, Mr. Albert Karvin","male",32,0,0,244.36,"wheelwright","Dead","C 4001",22.525,"U","S"
1103,"Finoli, Mr. Luigi","male",28,0,0,287.58,"wigmaker","Dead","SOTON/O.Q. 3101308",7.05,"U","S"
1104,"Deacon, Mr. Percy William","male",17,0,0,1824.24,"cutler","Dead","S.O.C. 14879",66.62505,"U","S"
1105,"Howard, Mrs. Benjamin (Ellen Truelove Arman)","female",54.5,1,0,1554.07,"breechesmaker","Alive","24065",26,"U","S"
1106,"Andersson, Miss. Ida Augusta Margareta","female",38,4,2,378.94,"wheelwright","Alive","347091",7.775,"U","S"
1107,"Head, Mr. Christopher","male",42,0,0,2248.51,"dentist","Dead","113038",42.5,"B11","S"
1108,"Mahon, Miss. Bridget Delia","female",28,0,0,172.72,"blacksmith","Alive","330924",7.8792,"U","Q"
1109,"Wick, Mr. George Dennick","male",54.5,1,1,2434.92,"music teacher","Dead","36928",66.62505,"U","S"
1111,"Thomson, Mr. Alexander Morrison","male",28,0,0,289.43,"blacksmith","Dead","32302",8.05,"U","S"
1112,"Duran y More, Miss. Florentina","female",30,1,0,1268.6,"coachmaker","Alive","SC/PARIS 2148",13.8583,"U","C"
1113,"Reynolds, Mr. Harold J","male",21,0,0,395.29,"barber","Dead","342684",8.05,"U","S"
1114,"Cook, Mrs. (Selena Rogers)","female",22,0,0,1161.29,"cabinetmaker","Alive","W./C. 14266",10.5,"F33","S"
1115,"Karlsson, Mr. Einar Gervasius","male",21,0,0,79.76,"wigmaker","Dead","350053",7.7958,"U","S"
1116,"Candee, Mrs. Edward (Helen Churchill Hungerford)","female",53,0,0,2111,"music teacher","Alive","PC 17606",27.4458,"U","C"
